{
  "external_ref": "6f1d2c3b-8a9e-4f70-b1c2-d3e4f5a6b7c8",
  "parent_ref": "0b7c6a2e-5d1f-4c1a-9a7e-2f4e9c1d8a01",
  "version": "1",
  "sensitivity": "public",
  "filename": "solicitud.pdf",
  "media_type": "application/pdf",
  "role": "main",
  "size_bytes": 184233,
  "page_count": 2,
  "sha256": "4f0c8a1d9b2e7c6a5f3e1d0c9b8a7f6e5d4c3b2a1f0e9d8c7b6a5f4e3d2c1b0a",
  "content": {
    "mode": "locator",
    "locator": "att:6f1d2c3b-8a9e-4f70-b1c2-d3e4f5a6b7c8:v1"
  }
}
